{
  "format": "resonance.arrangement/v1",
  "name": "asset-kenney_city_roads__tile-slanthigh",
  "nodes": [
    {
      "id": "kenney_city_roads__tile-slanthigh",
      "type": "Model",
      "params": {
        "path": "res://assets/vendor/kenney_city_roads/kenney_city_roads__tile-slanthigh.glb",
        "name": "tile-slanthigh"
      }
    }
  ],
  "wires": []
}