{
  "format": "resonance.arrangement/v1",
  "name": "asset-kenney_city_roads__road-side",
  "nodes": [
    {
      "id": "kenney_city_roads__road-side",
      "type": "Model",
      "params": {
        "path": "res://assets/vendor/kenney_city_roads/kenney_city_roads__road-side.glb",
        "name": "road-side"
      }
    }
  ],
  "wires": []
}