{
  "format": "resonance.arrangement/v1",
  "name": "asset-kenney_nature__bed_floor",
  "nodes": [
    {
      "id": "kenney_nature__bed_floor",
      "type": "Model",
      "params": {
        "path": "res://assets/vendor/kenney_nature/kenney_nature__bed_floor.glb",
        "name": "bed_floor"
      }
    }
  ],
  "wires": []
}