{
  "format": "resonance.arrangement/v1",
  "name": "asset-kenney_nature__bridge_wood",
  "nodes": [
    {
      "id": "kenney_nature__bridge_wood",
      "type": "Model",
      "params": {
        "path": "res://assets/vendor/kenney_nature/kenney_nature__bridge_wood.glb",
        "name": "bridge_wood"
      }
    }
  ],
  "wires": []
}