{
  "format": "resonance.arrangement/v1",
  "name": "asset-kenney_city_roads__road-crossroad",
  "nodes": [
    {
      "id": "kenney_city_roads__road-crossroad",
      "type": "Model",
      "params": {
        "path": "res://assets/vendor/kenney_city_roads/kenney_city_roads__road-crossroad.glb",
        "name": "road-crossroad"
      }
    }
  ],
  "wires": []
}