{
  "format": "resonance.arrangement/v1",
  "name": "asset-kenney_city_roads__light-curved",
  "nodes": [
    {
      "id": "kenney_city_roads__light-curved",
      "type": "Model",
      "params": {
        "path": "res://assets/vendor/kenney_city_roads/kenney_city_roads__light-curved.glb",
        "name": "light-curved"
      }
    }
  ],
  "wires": []
}